title,views,published,length
GRAB YOUR COOKIES!,90,3 years ago,11:09
My recent challenge at work | Mapping UK POSTCODES to Rightmove location IDs using API,1000,3 years ago,12:52
SCRAPY CRASH COURSE | OnTheMarket UK real estate properties scraper | python web scraping tutorial,2600,3 years ago,39:42
creating WEB SCRAPING youtube TUTORIAL brought me a $25/hour UPWORK contract | 🤯 MIND BLOWING 🤯,664,3 years ago,10:02
EPYCO | running your WEB SCRAPERS or SCRAPY spiders in BACKGROUND,105,3 years ago,8:36
how to INCREASE number of VIEWS on YouTube using python SCRAPY PROXY rotation,18000,3 years ago,35:17
python SCRAPY crawling MULTIPLE PAGES | PAGINATION handling,5400,3 years ago,12:14
python SCRAPY how to WRITE scraped results to CSV | JSON | XML,4700,3 years ago,5:56
how to run SCRAPY spider FROM within a PYTHON SCRIPT,18000,3 years ago,3:38
BEGINNERS SCRAPY TUTORIAL - writing BARE MINIMUM class FOR DATA EXTRACTION,2100,3 years ago,19:09
how to start making money as a FREELANCER specializing in WEB SCRAPING | TOOLS & JOBS overview,6600,3 years ago,32:22
how to follow youtube programming tutorials,54,3 years ago,10:53
How to sound like native - my English progress and  accent evolution on YouTube,150,3 years ago,17:56
PROXY ROTATION crash course | Python + Requests & BeautifulSoup,13000,3 years ago,26:13
Python REQUESTS crash course in regards to WEB SCRAPING,390,3 years ago,18:56
how to inspect incoming HTTP requests on your website | UI + API python flask tutorial,155,3 years ago,26:42
Python CSV crash course,167,3 years ago,15:14
changing chess engine style of play by tuning evaluation scores | NO CODING SKILLS,225,3 years ago,4:48
obfuscating python code | inspired by Obfuscated C programs by Bisqwit,2100,3 years ago,13:58
Chess programming CRASH COURSE | inspired by Micro-Max chess engine by H.G. Muller,1700,3 years ago,1:13:03
I've ported a chess engine in pure javascript by Bluefever Software  to chrome extension,159,3 years ago,4:05
self taught programmer success story | what I learned from making 100+ programming videos,470,3 years ago,31:57
recursive web scraper | stock news web scraping tutorial | python requests beautifulsoup,729,3 years ago,41:41
coding web app to render CSV as responsive HTML table using Python Flask Bootstrap & Datatables,20000,3 years ago,31:07
How to convert JSON to CSV in Python,6900,3 years ago,6:45
scraping data without writing element extraction logic | hack to trick API if can't mimic it,65,3 years ago,10:59
how to change colorscheme in codemirror online code editor if it's not supported | dead simple hack,223,3 years ago,5:19
how to change font size in online text editors using developer tools console | dead simple hacks,393,3 years ago,4:16
coding chrome extension to change font size in online code editors,119,3 years ago,23:04
BEGINNERS' Python CRASH COURSE for WEB SCRAPING,613,3 years ago,53:09
experimental python IDE for cloud web scraping,51,3 years ago,9:01
Web scraping with Python + Requests & BeautifulSoup using OOP approach,903,3 years ago,38:17
how to deploy flask app on pythonanywhere | dead simple step by step guide,1000,3 years ago,13:51
how to reset usb device programatically on linux,157,3 years ago,5:01
How to hack MySQL | mysql injection vulnerability | Python and Flask app is used in this example,1500,3 years ago,12:24
Did you know that flask jinjia template renderer can be used within javascript?,68,3 years ago,6:46
EPYCO | simple hacking library to forward basic linux commands to python environment,38,3 years ago,11:48
Web scraping tutorial | Scraping e-commerce site | Python + Requests + BeautifulSoup,961,3 years ago,55:03
FREE Remote web scraping opportunity for you guys!,109,3 years ago,44:54
hacking RCE & SSTI remote code execution and server side template injection vulnerabilities of Flask,1600,3 years ago,28:28
coding web app for editing and executing python code to create web scrapers online,172,3 years ago,19:13
free online web scraping service - Code Monkey King's Dreams,96,3 years ago,14:53
Cheng style baguazhang 1st; 2nd and 3rd palm changes | 程氏八卦掌,193,3 years ago,3:03
image scraping | pinterest image web scraper tutorial | python requests beautifulsoup,4100,3 years ago,17:39
How to scrape unscrapable sites: web grabber chrome extension,600,3 years ago,8:31
US real estate properties from zillow | web scraping tutorial | Python Requests BeautifulSoup,6100,3 years ago,50:29
web scraper | UK real estate properties zoopla web scraping tutorial python requests beautifulsoup,1600,3 years ago,49:40
web scraper | UK real estate rightmove web scraping tutorial | python requests beautifulsoup,5200,3 years ago,50:29
Creating simple blog with Python; Flask; Sqlite3 and Bootstrap,3100,3 years ago,59:44
Python Flask simple CRUD app with Sqlite3 back-end,3500,3 years ago,27:00
Coding google analytics minimalist alternative using Python; Flask; Bootstrap; Jquery and Datatables,271,3 years ago,55:43
How to scrape infinite scroll page fed by AJAX request,3300,3 years ago,24:03
Python Flask Crash Course: episode 3 - JQuery infinite scroll page,847,3 years ago,26:50
Python Flask Crash Course: episode 2 - bootstrap powered front-end,232,3 years ago,25:06
Python Flask Crash Course: episode 1 - REST API for partial data rendering,891,3 years ago,18:48
Python Flask Jinjia crash course,141,3 years ago,20:32
Flask app to run web scraper from browser; render results using Jquery Datatables and download CSV,3200,3 years ago,1:05:15
Faking AJAX requests | Python + Requests & BeautifulSoup,3000,3 years ago,14:50
Extracting data from HTML table | Python + Requests & BeautifulSoup,5900,3 years ago,12:32
Downloading images from the web | Python + Requests & BeautifulSoup,427,3 years ago,20:16
New features at web scraping kung fu community site,51,3 years ago,5:30
Extracting data from multiple pages | Python + Requests & BeautifulSoup,1500,3 years ago,31:20
Extracting multiple elements from the page | Python + Requests & BeautifulSoup,286,3 years ago,26:21
Extracting items from single element | Python + Requests & BeautifulSoup,447,3 years ago,18:35
Web scraping kung fu project,74,3 years ago,9:40
web scraping | chinese kungfu movies web scraper tutorial | python requests beautifulsoup,368,3 years ago,1:11:27
web scraping | google search results web scraper tutorial | python requests beautifulsoup,14000,3 years ago,1:18:00
Pretty printing HTML response to console using beautiful soup's recursive child generator,102,3 years ago,14:32
Parsing HTML response in JSON format to list all the tags containing text and their attributes,723,3 years ago,12:48
Coding Lab: writing a web browser with command line interface,72,3 years ago,1:40:32
web scraping crash course | python requests beautifulsoup,520,3 years ago,1:06:49
web scraping | hacker news web scraper tutorial | python requests beautifulsoup,543,3 years ago,51:54
Coding lab: creating minimalist web scraping framework [100% live coding],58,3 years ago,57:35
web scraper | proxy list web scraping tutorial | python requests beautifulsoup,3100,3 years ago,16:19
Writing command line scraper fed by json config file + questions for viewers at the end,36,3 years ago,1:27:21
Cheng style baguazhang: lianhuan form | 程氏八卦掌,293,3 years ago,2:49
Silent coding: Creating visual scraping service with Python & Flask - episode 4,80,3 years ago,1:14:14
Silent coding: Creating visual scraping service with Python & Flask - episode 3,44,3 years ago,1:10:28
Simple visual scraping service with python + flask + requsts + beautiful soup,2800,3 years ago,10:01
Silent coding: Creating visual scraping service with Python & Flask - episode 2,85,3 years ago,30:54
Silent coding: Creating visual scraping service with Python & Flask - episode 1,204,3 years ago,2:31:06
Coding lab: rendering beautiful soup tree to html page - part3,29,3 years ago,43:41
Coding lab: rendering beautiful soup tree to html page - part2,326,3 years ago,45:21
Coding lab: rendering beautiful soup tree to html page - part1,64,3 years ago,49:02
Python Flask app template deployed at heroku [You can just skip watching this video...],129,3 years ago,33:59
Creating Web Search Engine in Python [100% live coding!]: final part + future project announcement,3000,3 years ago,56:09
Creating Web Search Engine in Python [100% live coding!]: part5 - creating search web app in flask,2700,3 years ago,1:48:19
Creating Web Search Engine in Python [100% live coding!]: part4 - connecting crawler to mongodb,1600,3 years ago,1:05:52
Creating Web Search Engine in Python [100% live coding!]: part3 - tuning web crawler,2000,3 years ago,48:45
Creating Web Search Engine in Python [100% live coding!]: part2 - creating basic web crawler,4400,3 years ago,1:47:09
Creating Web Search Engine in Python [100% live coding!]: part1 - Stack Overflow scraper,18000,3 years ago,1:15:42
Xiao Yao Bu - carefree wandering qigong,940,4 years ago,50:13
CHESS ENGINE in JAVASCRIPT similar to Micro-Max (uMax) by H.G. Muller & Toledo Nano Chess,271,4 years ago,18:55
python3 how to: split strings; replace characters; do list comprehensions,2500,4 years ago,5:00
how to convert string to integer and vice versa in python3,28000,4 years ago,2:46
Shi Ming legacy - ruyi taiji quan 37 form footage,4800,4 years ago,20:47
python scrapy spider - user agent spoofing,758,4 years ago,12:23
python scrapy shell - user agent spoofing,1900,4 years ago,7:44
how to make money on fiverr | web scraping | data mining | no coding skills,7600,4 years ago,18:38
python scrapy docs tutorial,316,4 years ago,43:20
My first working day at hourly paid job on upwork,73,4 years ago,15:31
python web scraping: free proxy list,3300,4 years ago,32:38
Specializing as freelancer in software development,22,4 years ago,18:58
How it feels to be a freelancer in software development (from beginner's point of view),27,4 years ago,19:08
community website with nodejs; express; mongodb; angular and bootstrap from scratch,132,4 years ago,8:11
brainfuck interpreter live coding in C,1800,4 years ago,1:10:30
arrays and pointers in c programming language,47,4 years ago,32:06
Nodejs + expressjs + mongodb web app #9: TODO-list deploy at heroku!,389,4 years ago,10:28
Nodejs + expressjs + mongodb web app #8: TODO-list - updating existing task,148,4 years ago,5:27
Nodejs + expressjs + mongodb web app #7: TODO-list - adding/removing tasks,119,4 years ago,12:14
Nodejs + expressjs + mongodb web app #6: TODO-list - displaying data from database,139,4 years ago,17:31
Nodejs + expressjs + mongodb web app #5: TODO-list - installing angular and bootstrap,118,4 years ago,11:17
How to learn things fast? - my experience in different life fields,42,4 years ago,24:09
How does it feel to be a self-taught programmer,38,4 years ago,14:10
Nodejs + expressjs + mongodb web app #4: TODO-list - adding/removing entries,272,4 years ago,13:12
Nodejs + expressjs + mongodb web app #3: TODO-list - changing existing data entry,97,4 years ago,12:06
Nodejs + expressjs + mongodb web app #2: TODO-list - retreiving data from mongodb,240,4 years ago,11:54
Nodejs + expressjs + mongodb web app #1: TODO-list - creating database & establishing the server,797,4 years ago,23:33
How to deal with mongodb's console client - the very basic web developer's guide,43,4 years ago,14:04
Is it really difficult to master web programming for beginners?,28,4 years ago,21:36
How to create a static website using node.js and expressjs framework in 6 lines of code!,331,4 years ago,25:43
Alternative way to get a job offer as software developer [Code Monkey King's blog #1],87,4 years ago,21:19
Cross-platform console game library in C: printing char/string at given (x; y) coordinates,46,4 years ago,7:30
Cross-platform console game library in C: complete example - SOKOBAN game,573,4 years ago,5:21
Cross-platform console game library in C: moving character + simple collision detection,188,4 years ago,12:53
Cross-platform console game library in C: initializing & PrintMap() function,61,4 years ago,6:47
Cross-platform console game library in C: Introduction & demonstration,416,4 years ago,19:02
Console game programming in C: SOKOBAN by Code Monkey King,7000,4 years ago,27:41
Brainfuck programming tutorial: part 7 - convert string to integer + little coding challenge,579,4 years ago,17:16
What is Code Monkey King's channel is all about?,54,4 years ago,12:47
Community showcase: brainfuck IDE with syntax highlighting and powerful debugger,486,4 years ago,13:44
Bare minimum chess program in C: Part6 - Code Monkey King plays against his own program,289,4 years ago,7:59
Bare minimum chess program in C: Part 5 - interaction with the user,190,4 years ago,9:38
Bare minimum chess program in C: part 4 - search & evaluation,370,4 years ago,18:25
Bare minimum chess program in C: part 3 - move generator,1000,4 years ago,34:21
Bare minimum chess program in C: Part2 - board representation & piece encoding,1200,4 years ago,17:51
Bare minimum chess program in C: Part1 - design and implementation overview + demonstration,6700,4 years ago,19:30
Low level program's control flow theory: part 3 - function calls implementation [Code Monkey King],35,4 years ago,12:43
Low level program's control flow theory: goto label statement(jump instruction) [Code Monkey King],37,4 years ago,10:38
Low level program's control flow theory: part 1 - instruction pointer register [Code Monkey King],58,4 years ago,10:10
Brainfuck programming tutorial: part 6 - if statements,1300,4 years ago,17:41
Brainfuck programming tutorial: part 5 - loops and simple arithmetics,910,4 years ago,14:01
Brainfuck programming tutorial: part 4 - read text to memory,419,4 years ago,11:29
Brainfuck programming tutorial: part 3 - variables,820,4 years ago,13:53
Brainfuck programming tutorial: part2 - environment & example programs,1000,4 years ago,6:43
Brainfuck programming tutorial: part 1 -  language reference,3400,4 years ago,9:28
Brainfuck interpreter written in brainfuck: dbfi - by Daniel B. Christofani - part 3: application,183,4 years ago,11:57
Brainfuck interpreter written in brainfuck: dbfi - by Daniel B. Christofani - part 2: implementation,211,4 years ago,21:16
Brainfuck interpreter written in brainfuck: dbfi - by Daniel B. Christofani - part 1: introduction,530,4 years ago,8:02
BOSS: Experimental brainfuck programming language environment for DOS [Code Monkey King],461,4 years ago,3:50
bootable brainfuck interpreter,601,4 years ago,5:02
Obfuscated C project: coding minimalist chess engine in one video [Code Monkey King],584,4 years ago,9:32
Beginner's C project: coding a brainfuck programming language interpreter [Code Monkey King],855,4 years ago,5:57
Beginner's C project: coding a simple program for making programming videos [Code Monkey King],176,4 years ago,3:01
