title,views,published,length
How to record desktop screen using Python; OpenCV & PyAutoGUI,3700,2 years ago,11:06
How to record video from a webcam using Python & OpenCV,6200,2 years ago,8:14
When you don't have a chromakey but want to have an epic background...,231,2 years ago,6:11
Contours & Masks using Python & OpenCV - How to separate object from image background?,12000,2 years ago,26:21
How to make a SIMPLE ANIMATION of FADE IN video effect using Python & OpenCV,1200,2 years ago,22:30
Fully Automated Whiteboard Animation with Python; OpenCV & PyAutoGUI,1600,2 years ago,5:37
Live coding an app for drawing with mouse using Python & OpenCV,1300,2 years ago,12:33
Image edge detection with Python and OpenCV,821,2 years ago,12:10
Convert An Image To Grayscale or Black And White using Python & OpenCV,6200,2 years ago,8:35
Doodly like animation drawing with PyAutoGUI | Drawing automation with python,809,2 years ago,8:43
Draw Korean actress Lee Min-jung ( 이민정 ) and Play Virtual Piano | Python automation with PyAutoGUI,173,2 years ago,3:53
ZX Spectrum styled Youtube channel intro with PyAutoGUI; Pinta; Virtual Piano and Shotcut,49,2 years ago,0:21
I Draw Dr. Pi Like A Printer with PyAutoGUI feat. Hans Zimmer | Drawing automation with Python,255,2 years ago,5:13
I Draw Like A Printer ( self-portrait ) with PyAutoGUI | Python automation for drawing,2100,2 years ago,8:51
How to make money on music covers without copyright claims?,100,2 years ago,11:49
Goblin OST - 운명  (Fate) | Virtual Piano cover by PyAutoGUI,122,2 years ago,1:40
Yann Tiersen - Comptine d'un autre été (Amélie) | Virtual Piano cover by PyAutoGUI,75,2 years ago,3:21
Yann Tiersen - La Valse d'Amelie | Virtual Piano cover by PyAutoGUI,105,2 years ago,3:59
Interstellar Main Theme  OST | Hans Zimmer - First step | Virtual piano cover by PyAutoGUI,246,2 years ago,3:39
Yiruma; (이루마) - River Flows in You | Virtual Piano cover by PyAutoGUI,348,2 years ago,2:07
I played YIRUMA - RIVER FLOWS IN YOU on Virtual Piano from Python | PyAutoGUI keyboard automation,653,2 years ago,7:41
Mouse and keyboard automation using Python | PyAutoGUI,605,2 years ago,11:29
LIVE CODING web based FILE MANAGER with Python & Flask,3300,2 years ago,1:03:04
Моя ежедневная практика улучшения уровня английского / My continuous improvement practice in English,51,2 years ago,57:24
Turning YouTube into a job in 2021: my experience,65,2 years ago,22:59
Web scraping as a job in 2021: Pros & Cons,395,2 years ago,17:22
Лондон из зе кэпитал оф Грейт Британ / British blogger reaction to Ukrainian English textbook,162,2 years ago,44:53
CMK & Dr. Pi - behind the scenes: completely done after 2 hours! | Как мы снимали интервью),46,2 years ago,7:15
Британец учится говорить на русском! | Dr. Pi speaks Russian with almost perfect pronunciation!,51,2 years ago,16:52
Британский фрилансер и блогер учит русский алфавит! | Dr. Pi acquires Russian alphabet from CMK!,54,2 years ago,15:53
Dr. Pi & CMK - behind the scenes: Dr. Pi forgets that we're recording and destroys my monetization!,53,2 years ago,2:24
"Как понимать английский на слух? Показываю! / Code Monkey King reacts to ""Why?"" by Dr. Pi",65,2 years ago,53:12
Python programming; web scraping; English; Korean and now Qigong? Many expressions of a single flow!,109,2 years ago,8:32
Как пройти собеседование на английском? | How to compose your developer's story as a freelancer?,45,2 years ago,48:25
Как учить английский язык? Сам понял пока делал это видео! English tense system & sentence building,59,2 years ago,1:22:26
How to make money on open source software? | Как зарабатывать на Open Source?,102,2 years ago,58:02
Английский в IT: целый час говорю с носителем языка! / Interview with a former CISCO engineer Dr. PI,155,2 years ago,1:12:04
"Зарплаты в IT - от чего зависят; мой опыт как ""ВОЙТИ И УЙТИ ИЗ АЙТИ"" | What affects IT salaries?",157,2 years ago,1:34:36
Как начучиться думать на английском? | Learn to think in English like native speakers do!,69,2 years ago,1:34:41
Advanced English Tutorial: Building a REALLY LONG ENGLISH sentence with all the bells and whistles!,76,2 years ago,55:57
How to directly download a file protected by HTTP Strict Transport Security (HSTS) using Python,214,2 years ago,6:09
러시아어를 구사하는 우크라이나 남자가 한국게 사람들 영어를 가르치다: 영어 대명사,84,2 years ago,13:33
러시아어를 구사하는 우크라이나 남자가 한국게 사람들 영어를 가르치다: 영어 문장의 어순,201,2 years ago,9:20
How to bring your English to the next level | 러시아 남자는 한국 사람들에게 영어를 가르치고 싶어요,72,2 years ago,45:24
Live coding a simple web applications for displaying & editing CSV files as simple HTML tables,2600,2 years ago,2:56:46
I made a web scraping tutorial in Korean after 1 month of studying Korean - 외국인이 한국어로 프로그래밍 영상 제작,143,2 years ago,20:57
My bare python web scraping tutorial helped my subscriber to land a job + thoughts on learning path,173,2 years ago,18:15
Korean sentence building practice - composing an intro for my future web scraping tutorial in Korean,54,2 years ago,39:49
I scored 71/100 in Korean most common verbs quiz!,31,2 years ago,27:03
The conceptual difference between tenses in Korean and English - VERB and TENSE oriented mentality,50,2 years ago,38:17
Practicing Korean sentence building with CAN / CAN'T and working on speaking errors I've made before,40,2 years ago,31:55
5 Korean grammar points in one YouTube video thumbnail!,23,2 years ago,33:05
MY ONE MONTH KOREAN PROGRESS - I SPEAK FOR A MINUTE AND A HALF IN ONE TAKE; 개월 한국어 공부해 그리고 말하고 수 있어요,160,2 years ago,1:31
How to connect TWO KOREAN VERBS in ONE SENTENCE | Noob's approach for all occasions,493,2 years ago,24:12
TOP 5 Korean learning YouTube channels to move off the dead point & build your own learning map,56,2 years ago,54:09
How to Build Korean Sentences | Korean Grammar | I do my korean101.com homework,36,2 years ago,57:19
Free online Korean sentence builder tool by Code Monkey King,45,2 years ago,20:47
Most commonly used Korean words interactive database,35,2 years ago,23:17
Downloading most common Korean words with ONE LINE of PYTHON code | 한 줄의 파이썬 코드로 가장 일반적인 한국어 단어 다운로드,111,2 years ago,9:57
How I used PYTHON CODE to improve my KOREAN | 한국어를 향상시키기 위해 파이썬을 사용한 방법,207,2 years ago,22:34
Rendering static HTML page with responsive TABLE using Python; Jinjia2 & Datatables,456,2 years ago,53:14
Python web scraping techniques applied to extract Korean conjugated verb forms from koreanverb.app,95,2 years ago,16:36
Automated bulk translation of tokenized Korean words using translate.com API; Python & Requests,56,2 years ago,14:35
Tokenizing Korean text into words meanwhile associating them to the parts of speech | Python; Konlpy,159,2 years ago,22:55
Introduction to auto generating vocabulary from text with Python; koNLPy and Google Translate API.,173,2 years ago,22:36
Who the heck is Code Monkey King?,125,2 years ago,26:18
I do Korean self dictation | 저는 자기 받아쓰기를해요,23,2 years ago,19:20
Live coding web based Hangul text input widget & simple Korean visual keyboard in pure JavaScript,149,2 years ago,52:09
Breaking down Korean reading practice | 저는 한국어 문장 읽어요,35,2 years ago,57:39
K-Drama dialogue with Korean & English subtitles + literal translation to study | 쓸쓸하고 찬란하神 – 도깨비,100,2 years ago,1:49
한국어 학습자은 한국어로 랩을 읽습니다 | I created a parody rap from all Korean words I know and performed it live),39,2 years ago,2:03
한국어는 프로그래밍 언어입니까? Is Korean a programming language? DO-WHILE; IF: Korean grammar patterns revealed!,115,2 years ago,31:34
여자는 남자보다 예뻐질 수도 있으니까 옷을 더 비싼 입어야 될 것 같아요 | Flow driven vs traditional approach in Korean learning,45,2 years ago,1:16:52
I say 내일은 오늘보다 추워질 수도 있으니까옷을 따뜻하게 입어야 될 것 같아요 so Google recognizes it; Korean pronunciation practice,94,2 years ago,48:16
나는 일주일 동안 공부해 한 외국 한국어를 말한다 | Code Monkey King's interactive conversational Korean vocabulary online,53,2 years ago,50:50
Code Monkey King takes 간장 공장 공장장은 강 공장장이고 된장 공장 공장장은 강 공장장이다 challenge by 송원섭,85,2 years ago,17:08
Native language reveal on reaching 2K+ subs | Я говорю на русском языке,57,2 years ago,53:30
Newbie Korean Learner's nightmare: grammar rules vs conversational patterns,53,2 years ago,51:27
Hot to say I love you in Korean | beginner's sentence building practice,77,2 years ago,47:48
How to type in Korean and verify your pronunciation with Google Translate,65,2 years ago,19:31
Why I started learning Korean,183,2 years ago,1:54:59
Why I've dropped web scraping & freelancing,1100,2 years ago,58:00
Maintaining WEB SCRAPERS | FIXING BROKEN SELECTORS in existing scraper,457,2 years ago,1:32:25
Understanding POINTERS vs DEEPCOPY difference in high level languages like PYTHON & JAVASCRIPT,287,2 years ago,28:27
Links extraction with Scrapy,1000,2 years ago,26:13
Which websites to pick up for WEB SCRAPING jobs which not and why,629,2 years ago,25:05
Web scraping SPORTS BET Soccer odds via faking AJAX request,11000,2 years ago,16:08
Web scraping LOCALE SPECIFIC data via providing 'accept-language' HTTP header,586,2 years ago,10:30
WEB SCRAPING JOB accomplishment for my client,574,2 years ago,1:29:34
Coding tic tac toe AI using reinforcement learning (MCTS): backpropagation & FINAL RESULT demo,1200,2 years ago,22:35
Coding tic tac toe AI using reinforcement learning (MCTS): rollout simulation,648,2 years ago,13:12
Coding tic tac toe AI using reinforcement learning (MCTS): expanding NODES to populate GAME TREE,584,2 years ago,12:43
Coding tic tac toe AI using reinforcement learning (MCTS): selecting NODES in GAME TREE,613,2 years ago,4:53
Coding tic tac toe AI using reinforcement learning (MCTS): exploration/explotation tradeoff with UCT,952,2 years ago,25:35
Coding tic tac toe AI using reinforcement learning (MCTS): defining MCTS class,913,2 years ago,22:10
Coding tic tac toe AI using reinforcement learning (MCTS): defining TREE NODE class,938,2 years ago,15:26
Coding tic tac toe AI using reinforcement learning (MCTS): implementing GAME LOOP,848,2 years ago,28:05
Coding tic tac toe AI using reinforcement learning (MCTS): generating LEGAL MOVES (board states),833,2 years ago,28:12
Coding tic tac toe AI using reinforcement learning (MCTS): getting terminal game states (WIN/DRAW),1100,2 years ago,25:41
Coding tic tac toe AI using reinforcement learning (MCTS): defining board class & make move method,3300,2 years ago,38:11
Coding tic tac toe AI using reinforcement learning (MCTS): intro & demo,8700,2 years ago,8:18
Web scraping list of LAWYERS from gtla.com for my subscriber | Python SCRAPY,352,2 years ago,1:13:04
Web scraping JSON data in ONE LINE of PYTHON code | Crestron commercial dealers with SCRAPY,385,2 years ago,19:59
Real estate sites crawling strategy + template scraper | Python SCRAPY,800,2 years ago,13:54
WEB SCRAPING TABLES from WEBSITES in ONE LINE of PYTHON CODE written within a SCRAPY SHELL,1000,2 years ago,14:59
What I've learned from writing 100+ REAL ESTATE PROPERTY scrapers,314,2 years ago,36:02
MASSIVE WEB SCRAPING - improving the crawling through REAL ESTATE PROPERTIES sites | Python SCRAPY,1700,2 years ago,33:38
I bought lapel mic BOYA BY-M1 to improve the sound quality of my programming tutorials,79,2 years ago,4:14
CMK gets 1K subs! Recent projects & new plans regarding the channel development,65,2 years ago,19:02
I got ACCEPTED BY chess programming COMMUNITY link to my channel was added to CHESS PROGRAMMING WIKI,145,3 years ago,3:27
Proper way of passing FORM DATA along with POST request | Python SCRAPY tutorial,3700,3 years ago,20:39
How to make POST request with SCRAPY and pass form data - FormRequest alternative that always works,2800,3 years ago,17:47
I'VE CREATED 26 CHESS PROGRAMMING VIDEOS WITHIN THE LAST FEW DAYS,147,3 years ago,1:01:03
I'm starting new YouTube channel!,216,3 years ago,8:25
python programming assignments - Extracting 25 most common words from a website with bare Python,1000,3 years ago,41:51
Helping my subscriber to handle option select on change event to download files using Python & Flask,340,3 years ago,15:15
Scraping smartphones price list from E-Commerce site in 1 line of code written within a scrapy shell,1300,3 years ago,37:43
BRAINFUCK encryption - SACRILEGIOUS web site DATA EXTRACTION PREVENTION by Code Monkey King,234,3 years ago,58:09
Crafting E-Commerce site out of CSV price list in under 45 minutes with Python & Flask,817,3 years ago,43:34
udemy python courses web scraping tutorial,3000,3 years ago,1:33:56
Sacrilegious WEB SCRAPING data protection created on the knee by Code Monkey King,162,3 years ago,1:02:16
Sacrilegious WEB SCRAPING challenge - only LING LING can solve it!,239,3 years ago,39:40
WEB SCRAPING BENCHMARK in 1 LINE OF CODE to reveal possible data leaks in the spiders | Scrapy Shell,163,3 years ago,43:31
Bulk downloading FREE IRISH LACE MOTIF PATTERNS in 1 LINE OF PYTHON CODE written in the SCRAPY SHELL,416,3 years ago,8:15
Coding VISUAL HTML element SELECTOR tool running within Chrome Developer tools console using JQuery,256,3 years ago,36:09
Upwork direct contracts to charge non-Upwork clients,4300,3 years ago,4:52
Making $50 on web scraping in less than 40 minutes via writing 1 LINE OF CODE in the SCRAPY SHELL,340,3 years ago,36:16
Coding JSONL to Python dictionary parser,1500,3 years ago,21:38
How to get rid of indentations in JSONL files in ONE LINE of PYTHON code,547,3 years ago,10:20
Real World WEB SCRAPING project that runs completely IN BROWSER using Chrome Devtools & JQuery,397,3 years ago,6:33
WEB SCRAPING MAGIC - IN-BROWSER website CRAWLING & DATA EXTRACTION using Chrome Devtools & JQuery,414,3 years ago,9:36
How to bypass CAPTCHA | Scraping Spanish real estate properties using Chrome Devtools and JQuery,1500,3 years ago,37:48
No more SELENIUM - PAGINATION CRAWLING using Chorme Developer Tools and JQuery for WEB SCRAPING,682,3 years ago,9:32
Scraping LINKEDIN using Chrome Developer Tools,3200,3 years ago,10:21
WEB SCRAPING in WEB BROWSER with JQuery CRASH COURSE,2000,3 years ago,41:17
Extracting HTML table DATA and downloading it as CSV file using Chrome Developer Tools and JQuery,1900,3 years ago,21:26
Web scraping in browser - my very first attempt to scrape data using bare Chrome Developer Tools,1600,3 years ago,36:26
Coding infinite scroll Reddit scraper for my subscriber | Python SCRAPY,846,3 years ago,33:54
IMPORTANT NOTE for those who is asking Code Monkey King for HELP via EMAIL,152,3 years ago,3:44
Helping my subscriber to extract coupon codes in 1 LINE OF PYTHON CODE written within a SCRAPY Shell,156,3 years ago,2:22
REAL WORLD web scraping project in 1 LINE OF PYTHON CODE within a SCRAPY Shell by Code Monkey King,177,3 years ago,17:40
Downloading INVOICE images in ONE LINE OF CODE within a SCRAPY Shell,101,3 years ago,6:21
My subscriber has created ONE LINE SCRAPER to extract URLs - helping him to make it work properly,85,3 years ago,9:37
The most weird way to use SCRAPY Shell by Code Monkey King,129,3 years ago,27:46
Scraping FREE PROXY LIST in 1 LINE OF PYTHON CODE within a SCRAPY Shell,1500,3 years ago,6:12
Scraping real estate properties data from realtor.com in ONE LINE OF CODE within a SCRAPY Shell,842,3 years ago,36:48
Scraping HTML table data from multiple pages to CSV in ONE LINE OF PYTHON CODE within SCRAPY Shell,945,3 years ago,13:31
Helping my subscriber to reverse engineer AJAX request to get e-commerce products using SCRAPY Shell,433,3 years ago,13:07
ONE LINE OF PYTHON CODE within SCRAPY Shell to scrape cities' data from Real Estate website's API,112,3 years ago,10:46
Scraping the list of cities in Poland from wikipedia by typing THE ONLY LINE OF CODE in SCRAPY Shell,121,3 years ago,3:51
PERFECT REQUEST OF ON DEMAND WEB SCRAPING TUTORIAL | Multi level recursive site crawling | SCRAPY,508,3 years ago,53:37
Helping my subscriber to store data to CSV in 1 LINE scraper he has created using SCRAPY Shell,144,3 years ago,11:20
Ultimate WEB SCRAPING guide on Code Monkey King's YouTube channel,1000,3 years ago,42:00
1 LINE recursive NEWS SCRAPER with SCRAPY SHELL | Python one liner,207,3 years ago,16:12
Real Estate property scraper in 1 LINE OF CODE using SCRAPY shell,407,3 years ago,37:00
Quotes scraper in only 2 LINES OF CODE | Python + Requests & Beautiful Soup,411,3 years ago,16:22
How to scrape PDF files using Python + Requests and BeautifulSoup,13000,3 years ago,33:36
Helping my subscriber to extract data from br tags using SCRAPY Shell in 2 ways,655,3 years ago,25:01
I've spent 4 hours to help my subscriber BYPASSING ANTI SCRAPING measure based on COOKIE INSPECTION,4900,3 years ago,20:08
Tiny Scraper CRASH COURSE (Advanced) | beginners friendly WEB SCRAPING library by Code Monkey King,424,3 years ago,1:02:59
Tiny Scraper CRASH COURSE (Basic) | beginners friendly WEB SCRAPING library by Code Monkey King,404,3 years ago,24:18
Building minimalist OPEN SOURCE web scraping library with BARE PYTHON,852,3 years ago,1:41:41
Parsing HTML document with Python and Regular Expressions for web scraping purposes,7200,3 years ago,33:46
How to make PUT requests with SCRAPY to handle infinite scroll | Yahoo Answers web scraping tutorial,557,3 years ago,1:30:49
Working on REAL WORLD web scraping project | Scraping product details from hummart.com,675,3 years ago,2:51:53
My Subscriber did successfully start his freelancing career on Upwork!,155,3 years ago,21:29
Scraping list of ALL Italian POSTAL CODES | Python + Requests & BeautifulSoup + Regex,243,3 years ago,1:00:04
The VERY BASICS of BeautifulSoup HTML parsing: the bare minimum you should know to start freelancing,395,3 years ago,41:49
How Eastern VS Western consciousness works in regards to software development | Code Monkey King,133,3 years ago,39:38
養生太極掌第一套 Yangsheng Taichi Palm by Code Monkey King,298,3 years ago,5:51
Scraping sports data for analytics and machine learning | Professional boxers database | SCRAPY,757,3 years ago,2:56:00
"ESCAPING ""I can't get a job with no experience and I can't get experience without a job"" DILEMMA",126,3 years ago,13:44
Working with COOKIES and HEADERS in Python SCRAPY framework or REQUESTS package,7800,3 years ago,53:28
Helping my subscriber to extract variable's data from javascript file,227,3 years ago,32:37
Scraping Spanish real estate properties from idealista.com | REAL WORLD project | Python SCRAPY,4300,3 years ago,2:34:49
Scraping ALL Spain postal codes | Data extraction tutorial | Python + Requests & BeautifuSoup,990,3 years ago,49:56
From NO SKILLS to landing a JOB OF YOUR DREAM as PYTHON DEVELOPER specializing in WEB SCRAPING,272,3 years ago,1:15:20
Making $100 in 3 hours on real world WEB SCRAPING project | Nederland real estate property scraper,1200,3 years ago,2:57:53
Helping my subscriber to scrape INFINITE SCROLL / DYNAMICALLY LOADED pages fed by AJAX with SCRAPY,2900,3 years ago,53:35
Helping my subscriber to create Flask app running google search scraper to mimic Google behavior,258,3 years ago,49:07
Scraping images with Python SCRAPY | 2 lines of code solution | No Image Pipelines,645,3 years ago,36:57
Helping my subscriber to scrape JOB ADs from jobs.lk | Python + Requests & BeautifulSoup,182,3 years ago,52:24
Scraping Austrian real estate properties from Willhaben | Python SCRAPY,1600,3 years ago,1:39:26
Scraping Scrapy blog articles by Aaron S. from medium,1100,3 years ago,1:00:37
Working on subscriber's code to fit the output to CSV format | Python Scrapy,148,3 years ago,45:45
Selling DATA VS selling CODE | How to land freelance jobs in web scraping niche,294,3 years ago,40:21
Scraping Pakistan real estate properties from Zameen for my subscriber | Python Scrapy,1600,3 years ago,2:28:20
Best Practices VS Real World experience in web scraping | Dr Pi's code review/reaction,181,3 years ago,36:13
Scraping location IDs from Austrian real estate properties site | Python Scrapy,216,3 years ago,27:09
Scraping list of all Austrian postal codes from Wikipedia | Python + Requests & BeautifulSoup,474,3 years ago,25:32
WEB SCRAPING in BARE PYTHON CHALLENGE | Recursive HTML element scraping,129,3 years ago,1:04:48
Writing PYTHON script to display WEB CAMERA view in a window using OpenCV,361,3 years ago,15:16
"WEB SCRAPING in BARE PYTHON | HTML parsing with ""html.parser""",2400,3 years ago,1:26:53
"WEB SCRAPING in BARE PYTHON | HTTP requests with ""urllib""",1100,3 years ago,50:45
"Scraping ""YELLOW PAGES"" in SWITZERLAND | Web scraping tutorial based on REAL WORLD SCRAPY project",454,3 years ago,1:58:10
Scraping BAHRAIN real estate property UNDER THE RAIN | The most romantic web scraping tutorial ever,329,3 years ago,1:32:26
How to run Scrapy spider from Flask app - extended answer to my subscriber's email,1900,3 years ago,2:19:02
Ultimate web scraping tutorial on numerous subscriber's demands - zillow US real estate properties,1700,3 years ago,2:54:21
Scraping German real estate properties from immobilienscout24.de using Scrapy | REAL WORLD project,3100,3 years ago,2:23:20
Scraping German city links from for the later dynamic generation of URLs to crawl | Python Scrapy,626,3 years ago,56:44
Scraping list of all German postal codes using Pytnon & Requests + BeautifulSoup,254,3 years ago,46:41
My subscriber's web scraping code review,114,3 years ago,44:17
Scraping Qatar real estate properties for my subscriber | on demand web scraping tutorial | SCRAPY,484,3 years ago,56:08
"""Challenging web site scrapping"" - processing yet another help request from one of my subscribers",555,3 years ago,1:24:30
Helping my subscriber to extract links from the table | Python | Requests + BS4 | Scrapy,150,3 years ago,1:05:23
Scraping Switzerland real estate properties | Master class by Code Monkey King | Python SCRAPY,631,3 years ago,1:19:21
Scraping Switzerland zipcode labels from REST API | A part of my REAL WORLD web scraping project,440,3 years ago,28:32
Yet another web scraping tutorial on demand | extracting data from slickdeals.net | Python SCRAPY,694,3 years ago,42:36
Referencing JAVASCRIPT variables from within a PYTHON script for web scraping purposes using REGEX,724,3 years ago,24:25
Debugging existing SCRAPY SPIDER data extraction logic using SCRAPY SHELL,390,3 years ago,17:40
Extracting EMAILS and PHONES from website contacts | Python Requests BeautifulSoup Regex,3200,3 years ago,54:13
Debugging SCRAPY data extraction logic outside of response context using SELECTORS,414,3 years ago,20:17
Code Monkey King feat. Dr Pi - Business Bullshit | FULL VERSION,113,3 years ago,1:47
Web scraping freelancer's routine working days - debugging SCRAPY spider's pagination crawling logic,603,3 years ago,54:18
Code Monkey King - Business Bullshit,75,3 years ago,1:38
Code Monkey King - Coding Rap,115,3 years ago,1:01
I'm trying to rap after Eminem to improve my English,56,3 years ago,21:28
Working on REAL WORLD WEB SCRAPING project on FREELANCE | Python Scrapy,4400,3 years ago,2:14:03
Dr Pi challenged me to a CODING RAP BATTLE!,58,3 years ago,4:17
Working LIVE on FREELANCE PROJECT | Scraping data for ML purposes | REAL world SCRAPY tutorial,1700,3 years ago,2:28:48
Scraping JSON data from SCRIPT tag | Extracting latitude and longitude from Zillow properties,2200,3 years ago,35:14
EPYCO on HEROKU | deploying Python Flask app on heroku tutorial,293,3 years ago,28:24
scraping highly unstructured data | zillow for rent web scraping tutorial | Python + Requests + BS4,1500,3 years ago,39:53
scrapy tutorial for beginners | scraping KINGSCRUSHER's chess games from LICHESS.org to PGN,742,3 years ago,38:05
Nominatim OpenStreetMap REVERSE GEOCODING | LATITUDE & LONGITUDE coordinates to STREET ADDRESS,4200,3 years ago,29:15
Nominatim OpenStreetMap GEOCODING | STREET ADDRESS to LATITUDE & LONGITUDE coordinates,12000,3 years ago,41:52
Scraping and forwarding data from multiple levels of a website and from API simultaneously | Scrapy,2400,3 years ago,1:04:46
Code Monkey King's reaction to Dr Pi's web scraping tutorial + code review to reveal CSV column bug,118,3 years ago,41:31
UK real estate properties VISUAL SCRAPER with feature selectors | Rightmove | Scrapy + Flask,442,3 years ago,3:11
US real estate monthly cost; property taxes and home insurance | zillow web scraping tutorial,220,3 years ago,12:12
Indian pharmacy WEB SCRAPING tutorial | Scraping INFINITE SCROLL pages | Python Scrapy,5000,3 years ago,29:57
WEB SCRAPING tutorial ON DEMAND,140,3 years ago,19:08
BAGUAZHANG CRASH COURSE | 程氏八卦掌,311,3 years ago,23:35
PDF to CSV data conversion | Python pdftotext CRASH COURSE,8300,3 years ago,16:33
Python script to translate phrases using Google Translate API,1400,3 years ago,8:30
Indian OLX  web scraping tutorial | Extracting dynamically loaded content via fetching data from API,6300,3 years ago,38:42
